place,type,district,budget,description,best_time,weather,avg_cost,map_link,route,security,Nearby restaurants
Ahsan Manzil,Historical Palace,Dhaka,Low,Iconic pink palace and museum of Nawabs on Buriganga River with rich history,Year-round,Afternoon light best for photos,150-300,https://www.google.com/maps/search/Ahsan+Manzil+Dhaka,Rickshaw or walk from Sadarghat,Generally safe popular tourist site; watch for pickpocketing in Old Dhaka crowds.,Ahsan Manzil nearby: Star Kabab, Local river view restaurants, Sadarghat eateries
Lalbagh Fort,Historical Fort,Dhaka,Low,17th-century Mughal fort with gardens, mosque and unfinished architecture,Year-round,Gardens pleasant in winter,100-250,https://www.google.com/maps/search/Lalbagh+Fort+Dhaka,Bus or rickshaw in Old Dhaka,Generally safe historic site with visitors; standard precautions in Old Dhaka.,Lalbagh area: Haji Biryani, Old Dhaka mezban, Local cafes
Sonargaon Historical Site,Historical Site,Dhaka,Medium,Ancient capital with folk museum, ruins and traditional architecture (day trip),Nov-Feb,Cool and dry,300-600,https://www.google.com/maps/search/Sonargaon+Dhaka,Bus from city center (1 hr),Generally safe day trip site.,Sonargaon local restaurants, Folk museum area eateries
Dhakeshwari National Temple,Religious,Dhaka,Low,National Hindu temple with intricate carvings and cultural significance,Year-round,Any time,Free-100,https://www.google.com/maps/search/Dhakeshwari+Temple+Dhaka,Old Dhaka area by rickshaw,Very safe religious site.,Temple area vegetarian & local food
Star Mosque,Religious,Dhaka,Low,Beautiful 19th-century mosque decorated with star-shaped tiles,Year-round,Any,Free,https://www.google.com/maps/search/Star+Mosque+Dhaka,Rickshaw in Armanitola Old Dhaka,Very safe historic mosque.,Armanitola local eateries
Baitul Mukarram National Mosque,Religious,Dhaka,Low,Modern national mosque resembling Kaaba with grand architecture,Year-round,Any,Free,https://www.google.com/maps/search/Baitul+Mukarram+Dhaka,Motijheel central area,Very safe central mosque with high footfall.,Motijheel restaurants, KFC, Local fast food
Jatiya Sangsad Bhaban,Architectural Landmark,Dhaka,Low,Iconic Louis Kahn-designed parliament building (exterior views),Year-round,Any,Free (outside),https://www.google.com/maps/search/Jatiya+Sangsad+Bhaban+Dhaka,Bus to Sher-e-Bangla Nagar,Generally safe for exterior views; photography restrictions may apply.,Sher-e-Bangla Nagar area restaurants
Ramna Park,Park,Dhaka,Low,Large urban green park with lake ideal for walks and picnics,Nov-Feb,Pleasant cool,Free-150,https://www.google.com/maps/search/Ramna+Park+Dhaka,Central Dhaka near university,Generally safe popular park; avoid after dark.,Ramna Park nearby: University area cafes, Dhaka Club restaurants
Bangladesh National Zoo,Zoo,Dhaka,Low,Popular zoo with diverse animals and family entertainment,Year-round,Mornings cooler,200-400,https://www.google.com/maps/search/National+Zoo+Dhaka,Mirpur bus route,Generally safe family attraction with crowds.,Mirpur zoo area restaurants, Family eateries
Bangladesh National Museum,Museum,Dhaka,Low,Large museum showcasing Bangladesh history, art and culture,Year-round,Indoor comfortable,150-300,https://www.google.com/maps/search/Bangladesh+National+Museum+Dhaka,Central location,Very safe indoor museum.,Shahbagh restaurants, Nando's, Local cafes
Liberation War Museum,Museum,Dhaka,Low,Museum dedicated to 1971 Bangladesh independence struggle,Year-round,Indoor,100-250,https://www.google.com/maps/search/Liberation+War+Museum+Dhaka,Bus accessible central,Very safe indoor museum.,Nearby Shahbagh eateries
Central Shaheed Minar,Monument,Dhaka,Low,Iconic monument honoring language movement martyrs,Year-round,Any,Free,https://www.google.com/maps/search/Central+Shaheed+Minar+Dhaka,University area,Very safe central monument.,University area street food & restaurants
Hatirjheel Lake,Park & Lake,Dhaka,Low,Modern urban lake with walking paths, lights and recreational areas,Year-round,Evening nice,Free-200,https://www.google.com/maps/search/Hatirjheel+Dhaka,Central Dhaka,Generally safe modern park; evenings popular but standard caution at night.,Hatirjheel lakeside restaurants, Rooftop cafes
Armenian Church,Historical Church,Dhaka,Low,17th-century church reflecting Armenian community heritage,Year-round,Any,Free,https://www.google.com/maps/search/Armenian+Church+Dhaka,Old Dhaka,Very safe historical church.,Old Dhaka nearby: Haji Biryani, Local food
Curzon Hall,Historical Building,Dhaka,Low,Colonial-era red-brick building part of Dhaka University,Year-round,Any,Free,https://www.google.com/maps/search/Curzon+Hall+Dhaka,University campus,Generally safe university area during day.,University canteens & cafes
Sadarghat River Port,Harbor,Dhaka,Low,Bustling river port with boat activity and Buriganga views,Year-round,Any,Free,https://www.google.com/maps/search/Sadarghat+Dhaka,Old Dhaka riverside,Busy port—watch for crowds and petty theft; chaotic area.,Sadarghat river view eateries, Local tea stalls
Botanical Garden,Nature Park,Dhaka,Low,Large garden with diverse plants, lakes and walking trails,Nov-Feb,Pleasant,100-250,https://www.google.com/maps/search/Botanical+Garden+Mirpur+Dhaka,Bus to Mirpur,Generally safe large garden.,Mirpur garden area restaurants
Jamuna Future Park,Shopping & Entertainment,Dhaka,Medium,Large modern shopping mall with amusement and dining,Year-round,Any,200-500,https://www.google.com/maps/search/Jamuna+Future+Park+Dhaka,North Dhaka bus,Generally safe modern mall with security.,Jamuna Future Park food court, Many chain restaurants
Khan Mohammad Mridha Mosque,Religious,Dhaka,Low,Historic Mughal-era mosque with beautiful architecture,Year-round,Any,Free,https://www.google.com/maps/search/Khan+Mohammad+Mridha+Mosque+Dhaka,Old Dhaka,Very safe historic mosque.,Old Dhaka local food
Bahadur Shah Park,Park,Dhaka,Low,Historic park with colonial monuments and greenery,Year-round,Any,Free,https://www.google.com/maps/search/Bahadur+Shah+Park+Dhaka,Old Dhaka,Generally safe historic park.,Old Dhaka eateries
Gulshan Lake Park,Park,Dhaka,Low,Urban lake park popular for walks and relaxation,Year-round,Evening,Free-150,https://www.google.com/maps/search/Gulshan+Lake+Park+Dhaka,North Dhaka,Generally safe upscale area park.,Gulshan restaurants, Many upscale eateries
New Market,Market,Dhaka,Low,Bustling traditional shopping market with street food,Year-round,Any,100-300,https://www.google.com/maps/search/New+Market+Dhaka,Central Dhaka,Busy market—high risk of pickpocketing in crowds.,New Market street food, Numerous local restaurants
Kawran Bazar,Market,Dhaka,Low,Vibrant wholesale market with fresh produce and local life,Year-round,Any,Free-200,https://www.google.com/maps/search/Kawran+Bazar+Dhaka,Central,Very crowded wholesale market—caution for theft.,Kawran Bazar local food stalls
National Martyrs' Memorial,Monument,Dhaka,Medium,Iconic monument honoring 1971 war martyrs (Savar day trip),Year-round,Any,200-400,https://www.google.com/maps/search/National+Martyrs+Memorial+Savar,Bus to Savar (1 hr),Generally safe major memorial site.,Savar area restaurants
Shakhari Bazar,Street & Market,Dhaka,Low,Historic Hindu street with traditional shops and culture,Year-round,Any,Free,https://www.google.com/maps/search/Shakhari+Bazar+Dhaka,Old Dhaka,Generally safe cultural street; narrow and crowded.,Shakhari Bazar local sweets & food
Islampur Road,Market,Dhaka,Low,Traditional fabric and clothing wholesale market,Year-round,Any,Free-200,https://www.google.com/maps/search/Islampur+Road+Dhaka,Old Dhaka,Busy wholesale area—watch for crowds and theft.,Islampur local eateries
Bait-ur-Rouf Mosque,Modern Mosque,Dhaka,Low,Award-winning contemporary mosque architecture,Year-round,Any,Free,https://www.google.com/maps/search/Bait-ur-Rouf+Mosque+Dhaka,Central,Very safe modern mosque.,Nearby central restaurants
Nandan Park,Amusement Park,Dhaka,Medium,Water and amusement park for families,Year-round,Any,300-600,https://www.google.com/maps/search/Nandan+Park+Dhaka,Outskirts by bus,Generally safe family amusement park.,Park restaurants, Family food outlets
Mausoleum of Ziaur Rahman,Monument,Dhaka,Low,Memorial park for former president,Year-round,Any,Free,https://www.google.com/maps/search/Mausoleum+of+Ziaur+Rahman+Dhaka,Mirpur,Generally safe memorial park.,Mirpur nearby restaurants
Mausoleum of Kazi Nazrul Islam,Monument,Dhaka,Low,Memorial for national poet with serene gardens,Year-round,Any,Free,https://www.google.com/maps/search/Mausoleum+of+Kazi+Nazrul+Islam+Dhaka,University area,Very safe serene memorial.,University area cafes
Moder Gorob,Monument,Dhaka,Low,Memorial for freedom fighters,Year-round,Any,Free,https://www.google.com/maps/search/Moder+Gorob+Dhaka,University area,Very safe monument.,Nearby university eateries
Moinot Ghat,River Ghat,Dhaka,Low,Riverside ghat with boat views and local life,Year-round,Any,Free,https://www.google.com/maps/search/Moinot+Ghat+Dhaka,River area,Busy ghat—standard precautions.,Ghat side tea & food stalls
Museum of Independence,Museum,Dhaka,Low,Museum on Bangladesh independence history,Year-round,Indoor,100-250,https://www.google.com/maps/search/Museum+of+Independence+Dhaka,Central,Very safe indoor museum.,Central Dhaka restaurants
Bashundhara City Mall,Shopping,Dhaka,Medium,Large shopping complex with entertainment,Year-round,Any,200-400,https://www.google.com/maps/search/Bashundhara+City+Mall+Dhaka,North Dhaka,Generally safe modern mall with security.,Bashundhara food court, Many chain restaurants
Sher-e-Bangla Cricket Stadium,Landmark,Dhaka,Low,Iconic cricket stadium for sports fans,Event days,Any,50-300,https://www.google.com/maps/search/Sher-e-Bangla+Cricket+Stadium+Dhaka,Mirpur,Generally safe on event days with security.,Mirpur stadium area eateries
Dreamland Amusement Park,Amusement Park,Dhaka,Medium,Family amusement park with rides,Year-round,Any,300-600,https://www.google.com/maps/search/Dreamland+Amusement+Park+Dhaka,Outskirts,Generally safe family park.,Park nearby restaurants
Panthapath Area,Urban Area,Dhaka,Low,Modern urban hub with shops and street life,Year-round,Any,Free-200,https://www.google.com/maps/search/Panthapath+Dhaka,Central,Busy urban area—watch for traffic and petty crime.,Panthapath restaurants, Fast food chains
Saat Masjid,Religious,Dhaka,Low,Historic mosque complex,Year-round,Any,Free,https://www.google.com/maps/search/Saat+Masjid+Dhaka,Central,Very safe mosque complex.,Central Dhaka eateries
Kazi Nazrul Islam Avenue,Street,Dhaka,Low,Vibrant road with cultural significance,Year-round,Any,Free,https://www.google.com/maps/search/Kazi+Nazrul+Islam+Avenue+Dhaka,Central,Busy street—standard urban precautions.,Avenue side restaurants
Baridhara Park,Park,Dhaka,Low,Green park in diplomatic area,Year-round,Any,Free,https://www.google.com/maps/search/Baridhara+Park+Dhaka,North Dhaka,Generally safe upscale diplomatic area.,Gulshan/Baridhara upscale restaurants