place,type,district,budget,description,best_time,weather,avg_cost,map_link,route,security,Nearby restaurants
The Sundarbans,National Park & Wildlife,Khulna,Medium,World's largest mangrove forest and Royal Bengal Tiger habitat,Nov-Feb,Dry and pleasant,600-1500,https://www.google.com/maps/search/The+Sundarbans+Khulna,Boat from Khulna or Mongla,Moderate to high caution due to wildlife (tigers, crocodiles) and remote mangrove environment; only visit with licensed organized tours and guides; follow all safety rules.,Mongla or Khulna tour operator restaurants, Hotel eateries in Mongla
Shait Gumbad Mosque (Sixty Dome),Religious & Historical,Khulna,Low,UNESCO-listed 15th-century mosque with unique domes,Year-round,Any,Free-200,https://www.google.com/maps/search/Shait+Gumbad+Mosque+Bagerhat,Bus from Khulna (1-1.5 hr),Very safe UNESCO heritage site with visitors.,Bagerhat local restaurants, Mosque area eateries
Khan Jahan Ali Tomb,Religious,Khulna,Low,Shrine of the saint who developed the region,Year-round,Any,Free-150,https://www.google.com/maps/search/Khan+Jahan+Ali+Tomb+Bagerhat,Bus,Very safe religious shrine.,Bagerhat shrine area food
Khulna Divisional Museum,Museum,Khulna,Low,Exhibits on regional history and archaeology,Year-round,Indoor,100-250,https://www.google.com/maps/search/Khulna+Divisional+Museum,In city center,Very safe indoor museum.,Khulna city restaurants, Handi Karai
Karamjal Wildlife Center,Wildlife,Khulna,Low,Sundarbans entry point with deer, monkeys and crocodiles,Nov-Feb,Pleasant,300-700,https://www.google.com/maps/search/Karamjal+Khulna,Boat from Mongla,Moderate caution due to wildlife; organized entry point with guides.,Mongla local restaurants
Rupsha Bridge,Landmark,Khulna,Low,Iconic bridge with river views,Year-round,Any,Free,https://www.google.com/maps/search/Rupsha+Bridge+Khulna,Local transport,Generally safe landmark for views.,Bridge side local eateries
Hiron Point,Sundarbans Viewpoint,Khulna,Medium,Scenic watchtower for wildlife in Sundarbans,Nov-Feb,Dry,500-1200,https://www.google.com/maps/search/Hiron+Point+Sundarbans,Organized boat tour,Moderate to high caution; remote Sundarbans area—only with organized tours.,Tour boat food or Mongla hotels
Kotka Beach,Sundarbans Beach,Khulna,Medium,Remote beach inside mangrove forest,Nov-Feb,Pleasant,700-1500,https://www.google.com/maps/search/Kotka+Beach+Sundarbans,Boat tour,High caution; remote mangrove beach—organized tours only and wildlife awareness needed.,Organized tour meals
Jamtola Beach,Sundarbans Beach,Khulna,Medium,Scenic mangrove beach area,Nov-Feb,Dry,600-1300,https://www.google.com/maps/search/Jamtola+Beach+Sundarbans,Boat,High caution; remote—organized tours essential.,Tour provided food
Shilaidaha Kuthibari,Historical,Khulna,Low,Rabindranath Tagore's historic residence,Year-round,Any,200-500,https://www.google.com/maps/search/Shilaidaha+Kuthibari+Kushtia,Bus,Generally safe historical site.,Kushtia local restaurants
Lalon Shah Mazaar,Religious & Cultural,Khulna,Low,Shrine of famous Baul saint Lalon,Year-round,Any,Free-150,https://www.google.com/maps/search/Lalon+Shah+Mazaar+Kushtia,Bus,Very safe cultural and religious shrine.,Lalon shrine area eateries
Wonderland Shishu Park,Amusement Park,Khulna,Low,Family park with rides and entertainment,Year-round,Any,150-400,https://www.google.com/maps/search/Wonderland+Shishu+Park+Khulna,Local,Generally safe family park.,Park family restaurants
Rupsha River Cruise,River Activity,Khulna,Medium,Scenic boat ride on Rupsha River,Nov-Feb,Calm waters,400-800,https://www.google.com/maps/search/Rupsha+River+Khulna,From ghat,Generally safe on organized river cruises.,Rupsha ghat eateries
Nine Dome Mosque,Religious,Khulna,Low,Historic mosque in Bagerhat complex,Year-round,Any,Free-150,https://www.google.com/maps/search/Nine+Dome+Mosque+Bagerhat,Bus,Very safe historic mosque.,Bagerhat local food
Ghora Dighi,Natural Lake,Khulna,Low,Scenic pond in Bagerhat area,Year-round,Any,100-300,https://www.google.com/maps/search/Ghora+Dighi+Bagerhat,Local,Generally safe pond area.,Bagerhat eateries
Bagerhat Museum,Museum,Khulna,Low,Exhibits on mosque city history,Year-round,Indoor,100-250,https://www.google.com/maps/search/Bagerhat+Museum,In Bagerhat,Very safe indoor museum.,Bagerhat restaurants
Khan Jahan Ali Bridge,Landmark,Khulna,Low,Modern bridge with city and river views,Year-round,Any,Free,https://www.google.com/maps/search/Khan+Jahan+Ali+Bridge+Khulna,Local,Generally safe bridge viewpoint.,Bridge side local restaurants
Dublar Char,Sundarbans Island,Khulna,Medium,Remote island for fishing and nature,Nov-Feb,Pleasant,800-1600,https://www.google.com/maps/search/Dublar+Char+Sundarbans,Boat,High caution; very remote Sundarbans island—organized tours only.,Tour meals on island
Kochikhali Wildlife Sanctuary,Wildlife,Khulna,Medium,Sundarbans sanctuary for trekking and wildlife,Nov-Feb,Dry,500-1100,https://www.google.com/maps/search/Kochikhali+Sundarbans,Boat,High caution due to wildlife and remoteness; guided tours required.,Organized tour food
Khulna University Campus,Campus & Nature,Khulna,Low,Beautiful campus with lakes and greenery,Year-round,Any,Free-100,https://www.google.com/maps/search/Khulna+University,Local bus,Generally safe university campus.,University canteens
Gollamari Memorial,Historical,Khulna,Low,1971 liberation war memorial,Year-round,Any,Free,https://www.google.com/maps/search/Gollamari+Memorial+Khulna,Bus,Generally safe memorial.,Nearby Khulna restaurants
Fultola Zoo,Wildlife Park,Khulna,Low,Small zoo with local animals,Year-round,Any,100-300,https://www.google.com/maps/search/Fultola+Zoo+Khulna,City,Generally safe small zoo.,Zoo area eateries
Shahid Hadis Park,Park,Khulna,Low,Urban park for relaxation and picnics,Year-round,Any,Free-150,https://www.google.com/maps/search/Shahid+Hadis+Park+Khulna,City bus,Very safe urban park.,Park nearby local food
Chandramahal Eco Park,Natural Park,Khulna,Low,Eco-park with natural beauty in Bagerhat,Year-round,Any,150-400,https://www.google.com/maps/search/Chandramahal+Eco+Park+Bagerhat,Bus,Generally safe eco-park.,Bagerhat local restaurants
Singair Mosque,Religious,Khulna,Low,Historic mosque in the mosque city area,Year-round,Any,Free-100,https://www.google.com/maps/search/Singair+Mosque+Bagerhat,Local,Very safe mosque.,Local Bagerhat eateries
Ronvijoypur Mosque,Religious,Khulna,Low,Another historic mosque in Bagerhat,Year-round,Any,Free-100,https://www.google.com/maps/search/Ronvijoypur+Mosque+Bagerhat,Bus,Very safe historic mosque.,Nearby food stalls
Khodla Math Temple,Religious,Khulna,Low,Ancient temple site,Year-round,Any,100-250,https://www.google.com/maps/search/Khodla+Math+near+Khulna,Local,Generally safe temple site.,Local temple area food
Harbaria Eco-Tourism Center,Natural Park,Khulna,Medium,Sundarbans eco-center for nature walks,Nov-Feb,Dry,400-900,https://www.google.com/maps/search/Harbaria+Eco+Tourism+Center,Boat,Moderate caution; Sundarbans eco-center—guided visits recommended.,Tour operator meals
Mandarbaria Island,Sundarbans Island,Khulna,Medium,Remote island with deer and birds,Nov-Feb,Pleasant,700-1400,https://www.google.com/maps/search/Mandarbaria+Sundarbans,Boat,High caution; remote island—organized tours only.,Tour provided food
Tin Kona Island,Sundarbans Island,Khulna,Medium,Scenic small island in mangroves,Nov-Feb,Dry,600-1200,https://www.google.com/maps/search/Tin+Kona+Island+Sundarbans,Boat,High caution; remote—tours essential.,Organized tour meals
Gilatala Public Zoo,Wildlife Park,Khulna,Low,Public zoo with animals,Year-round,Any,100-300,https://www.google.com/maps/search/Gilatala+Public+Zoo+Khulna,Local,Generally safe small zoo.,Local Khulna eateries
Floating Guava Market,Market & Cultural,Khulna,Low,Unique boat-based seasonal guava market,Post-monsoon,Refreshing,150-400,https://www.google.com/maps/search/Floating+Guava+Market+Barisal+side+Khulna,Boat from ghat,Generally safe seasonal cultural market; boat safety needed.,Ghat side seasonal stalls
Durga Sagar (accessible),Natural Lake,Khulna,Low,Large scenic pond with boating,Nov-Feb,Cool,200-500,https://www.google.com/maps/search/Durga+Sagar+near+Khulna,Local bus,Generally safe pond area.,Local pond eateries
30 Godown,Riverside Park,Khulna,Low,Historic riverside warehouse area,Year-round,Any,Free-150,https://www.google.com/maps/search/30+Godown+Khulna,City,Generally safe riverside spot.,Riverside cafes
Oxford Mission Church,Religious & Historical,Khulna,Low,Colonial-era church building,Year-round,Any,Free,https://www.google.com/maps/search/Oxford+Mission+Church+near+Khulna,Local,Very safe historical church.,Local Khulna restaurants
Kirtankhola River View (extension),River Viewpoint,Khulna,Low,Scenic river views,Nov-Feb,Calm,Free-200,https://www.google.com/maps/search/Kirtankhola+River+near+Khulna,Local,Generally safe river viewpoint.,Riverside eateries
Planet Park,Amusement Park,Khulna,Low,Family amusement area,Year-round,Any,150-350,https://www.google.com/maps/search/Planet+Park+Khulna,Local,Generally safe family park.,Park family food
Bonobilash Public Zoo,Wildlife Park,Khulna,Low,Another local zoo option,Year-round,Any,100-250,https://www.google.com/maps/search/Bonobilash+Public+Zoo+near+Khulna,Bus,Generally safe small zoo.,Local eateries
Wonderland Khalishpur,Amusement Park,Khulna,Low,Local entertainment park,Year-round,Any,150-400,https://www.google.com/maps/search/Wonderland+Khalishpur+Khulna,Local,Generally safe local park.,Khalishpur restaurants
Khalishpur Area View,Urban View,Khulna,Low,Bustling industrial and residential area,Year-round,Any,Free,https://www.google.com/maps/search/Khalishpur+Khulna,Local transport,Urban industrial area—standard precautions.,Khalishpur local food
Baitul Aman Jame Masjid,Religious,Khulna,Low,Beautiful mosque complex,Year-round,Any,Free,https://www.google.com/maps/search/Baitul+Aman+Jame+Masjid+near+Khulna,Local,Very safe mosque.,Mosque area eateries
Mainamati influence sites (accessible),Archaeological,Khulna,Low,Additional historical mounds if extended,Year-round,Any,150-350,https://www.google.com/maps/search/Mainamati+near+Khulna+side,Longer bus,Generally safe when accessible.,Extended area restaurants
Satkhira Sundarbans Entry,Wildlife,Khulna,Medium,Alternative Sundarbans access point,Nov-Feb,Dry,500-1100,https://www.google.com/maps/search/Satkhira+Sundarbans,Bus + boat,Moderate to high caution; Sundarbans area—organized tours recommended.,Satkhira local restaurants
Chuadanga Local Park,Park,Khulna,Low,Small local green space,Year-round,Any,Free-100,https://www.google.com/maps/search/Chuadanga+Park+near+Khulna,Bus,Very safe small park.,Chuadanga local food
Kushtia Cultural Spots,Cultural,Khulna,Low,Local cultural and folk sites,Year-round,Any,100-300,https://www.google.com/maps/search/Kushtia+near+Khulna,Bus,Generally safe cultural spots.,Kushtia Lalon area eateries
Bagerhat Mosque City Walk,Historical,Khulna,Low,Walking tour of multiple historic mosques,Year-round,Any,Free-200,https://www.google.com/maps/search/Bagerhat+Mosque+City,Local,Generally safe heritage walking area.,Bagerhat mosque city restaurants
Mongla Port View,Harbor View,Khulna,Low,Bustling port area near Sundarbans,Year-round,Any,Free,https://www.google.com/maps/search/Mongla+Port,Bus from Khulna,Busy port area—standard precautions; avoid restricted zones.,Mongla port restaurants